{
  "episode_id": "ForeignCarsTH_cadillac-cimarron",
  "status": "drafted",
  "thesis": "In 1982, an 80-year-old Cadillac tried to answer BMW, Audi, and Volvo's small sport sedans by building its own version of GM's new J-car, and made real (if late and limited) changes to trim, styling, equipment, and suspension tuning. It cost meaningfully more than a comparably equipped Chevrolet Cavalier, but because Cadillac joined the program too late to differentiate the car enough, it never fully shed its economy-car roots -- and it became the textbook cautionary tale of GM badge engineering.",
  "hook": "In 1982, Cadillac -- by then an 80-year-old luxury nameplate -- took GM's new compact economy car, gave it leather seats and a script badge, and asked buyers to pay a real premium for it. It didn't work, and people inside GM remembered it for decades afterward.",
  "estimated_runtime_sec": 480,
  "beats": [
    {
      "beat_id": "b1_cold_open",
      "summary": "Cold open on the hook: an established luxury brand puts its badge on a compact economy car and charges a real premium for it -- a decision people inside the company still cite as a cautionary tale.",
      "narration_notes": "Lead with the badge-on-an-economy-car setup and withhold the model name 'Cimarron' for a beat to build curiosity. Do not claim the price was 'double' here -- that number needs the precise comparison in beat b4. End on a question: how does an established luxury brand end up here?",
      "visual_notes": "Would be useful: a striking side-by-side still of a Cimarron and a same-year Cavalier badge/grille close-up; a period Cimarron print ad as an opening graphic."
    },
    {
      "beat_id": "b2_cadillacs_problem",
      "summary": "Context: by the early 1980s Cadillac's buyer base was aging, and fuel-economy/downsizing pressure plus a wave of European compact sport sedans (Cadillac's own launch materials and contemporary coverage name the BMW 320i, Audi 4000, Volvo, and Saab 900 as the competitive set, with the Honda Accord also cited in price comparisons) made GM want a smaller entry-luxury Cadillac to compete for younger buyers.",
      "narration_notes": "Establish the legitimate business problem before showing the bad solution. Use the specific named competitors (BMW 320i, Audi 4000, Volvo, Accord) rather than a vague 'European luxury cars' gesture -- do not include Mercedes 190 unless a source specifically ties it to the Cimarron's positioning.",
      "visual_notes": "Would be useful: period Cadillac showroom or lineup photos, and reference shots of a contemporary BMW 320i, Audi 4000, and Volvo for the competitive-set comparison."
    },
    {
      "beat_id": "b3_rushed_j_car",
      "summary": "GM's 1982 J-car platform was shared across five divisions (Chevrolet Cavalier, Pontiac J2000, Buick Skyhawk, Oldsmobile Firenza, Cadillac Cimarron). Cadillac joined the program late, and GM president Pete Estes reportedly warned Cadillac general manager Edward Kennard, 'Ed, you don't have time to turn the J-car into a Cadillac.'",
      "narration_notes": "This is the mechanism beat: badge-engineering as a rushed, top-down timing problem, not a simple lack of effort. The Estes-to-Kennard warning is now attributed to a named individual (Kennard) and can be used directly, but flag on screen as a widely repeated quote from secondary sources rather than a primary transcript.",
      "visual_notes": "Would be useful: GM J-car assembly-line or factory floor footage/photos from the era, and any archival image of the five J-car siblings lined up together to show how similar they were underneath."
    },
    {
      "beat_id": "b4_what_you_got",
      "summary": "Cadillac did make genuine changes -- standard air conditioning, extra sound insulation, deep-pile carpeting, alloy wheels, leather-wrapped steering wheel, full instrumentation, leather upholstery, and Cadillac-specific ('F41') suspension tuning -- but the platform, body structure, and (initially) the engine were shared with the Cavalier, and the 1982 Cimarron's $12,131-$12,181 base price sat well above even a loaded Cavalier CL (base ~$8,137, roughly $9,712 optioned to Cimarron-equivalent spec), a real premium of roughly $2,400-2,500 for comparably equipped cars -- far smaller than the near-double gap you get by comparing a base Cavalier to a loaded Cimarron. The core problem wasn't that nothing changed; it's that Cadillac joined too late to change enough of what buyers could see and feel.",
      "narration_notes": "Reframe from 'it was just badges and leather' to 'Cadillac tried, but ran out of time to differentiate it enough.' Use the comparably-equipped-Cavalier price gap (~25%), not a 'double the price' claim, and be explicit that the platform/body/suspension architecture (McPherson strut front, torsion-beam rear) stayed shared even where the tuning was Cadillac-specific.",
      "visual_notes": "Would be useful: matched interior shots of a Cimarron and Cavalier CL dashboard, a Cimarron window sticker/price sheet if one survives in archives, close-ups of the 'Cimarron by Cadillac' script badge, and any period comparison chart of standard equipment."
    },
    {
      "beat_id": "b5_market_reaction",
      "summary": "Contemporary reception in 1981-82 was genuinely mixed, not uniformly hostile: Car and Driver's original review (Rich Ceppos, August 1981) was notably positive about Cadillac's strategic boldness -- the author later said he felt embarrassed for having 'effused' over the car -- while Road & Track criticized the initial 1.8L engine's performance as 'painfully slow' (0-60 in 15.9 seconds). The much harsher, near-universal 'worst car' reputation is a retrospective judgment that solidified over the following decades, not the immediate press consensus at launch.",
      "narration_notes": "Explicitly separate two timelines: (a) contemporary 1981-82 reception, which was mixed -- some real praise for the concept, real criticism of the performance -- and (b) the retrospective reputation (beat b7), which is far more uniformly negative. Don't collapse these into one 'everyone mocked it immediately' narrative.",
      "visual_notes": "Would be useful: scans/covers of the August 1981 Car and Driver issue and any period Road & Track road test, archival news clippings covering the launch reception."
    },
    {
      "beat_id": "b6_slow_fix",
      "summary": "Between 1983 and 1988 Cadillac kept revising the car: styling updates, a 2.0L engine in 1983, a 2.8L V6 added as an option in 1985 (roughly 125-130 hp, standard by 1987), and suspension upgrades including an optional touring suspension with Bilstein shocks -- but sales fell in most of the later years of the run despite the improvements.",
      "narration_notes": "Show real, ongoing engineering effort without a turnaround ending -- this is a slow chase for credibility, not redemption.",
      "visual_notes": "Would be useful: year-by-year exterior styling comparison shots (1982 vs. 1985 vs. 1988), any engine bay shot showing the V6 update."
    },
    {
      "beat_id": "b7_cancellation_legacy",
      "summary": "Production ended in 1988 after roughly 132,499 total units (only 6,454 in the final year). In the decades since, the Cimarron has been named to lists like TIME's '50 Worst Cars of All Time' and is used as the standard example of badge-engineering gone wrong; former Cadillac product director John Howell reportedly kept a photo of a Cimarron in his office as a cautionary reminder.",
      "narration_notes": "Land the thesis here: the car's real legacy is retrospective -- a case study people inside and outside GM still reference, distinct from how it was actually received when new (beat b5).",
      "visual_notes": "Would be useful: a shot or graphic referencing a 'worst cars' list cover/headline, a late-production (1988) Cimarron for visual closure."
    }
  ],
  "key_factual_claims": [
    {
      "claim_id": "c1",
      "claim": "The 1982 Cadillac Cimarron's base price was $12,131-$12,181 (sources give both figures); a comparably equipped Chevrolet Cavalier CL (the top Cavalier trim) ran to roughly $9,712 when optioned to Cimarron-equivalent spec, a gap of about $2,400-2,500 -- versus a much larger gap against a base/stripped Cavalier (roughly $6,600-$8,137 depending on body style).",
      "relevant_beats": ["b4_what_you_got"],
      "source_url": "https://en.wikipedia.org/wiki/Cadillac_Cimarron",
      "note": "The comparably-equipped Cavalier CL figures ($8,137 base / $9,712 optioned) came from a web-search synthesis attributed to Curbside Classic's 'Vintage Reviews: Cadillac Cimarron 1982-1985' page, which returned HTTP 403 on direct fetch and could not be independently confirmed verbatim -- flagged in open_questions."
    },
    {
      "claim_id": "c2",
      "claim": "GM president Pete Estes warned Cadillac general manager Edward Kennard, 'Ed, you don't have time to turn the J-car into a Cadillac.'",
      "relevant_beats": ["b3_rushed_j_car"],
      "source_url": "https://en.wikipedia.org/wiki/Cadillac_Cimarron"
    },
    {
      "claim_id": "c3",
      "claim": "The Cimarron shared its J-body platform with the Chevrolet Cavalier, Pontiac J2000, Buick Skyhawk, and Oldsmobile Firenza.",
      "relevant_beats": ["b3_rushed_j_car"],
      "source_url": "https://en.wikipedia.org/wiki/Cadillac_Cimarron"
    },
    {
      "claim_id": "c4",
      "claim": "A 2.8L V6 became optional in 1985 (around 125-130 hp) and standard equipment by 1987.",
      "relevant_beats": ["b6_slow_fix"],
      "source_url": "https://www.conceptcarz.com/vehicle/z1990/cadillac-cimarron.aspx"
    },
    {
      "claim_id": "c5",
      "claim": "Cimarron production ended in 1988; total production across the model run was about 132,499 units, with only 6,454 built in the final year.",
      "relevant_beats": ["b6_slow_fix", "b7_cancellation_legacy"],
      "source_url": "https://www.goodcarbadcar.net/cadillac-cimarron-sales-figures/"
    },